{
  "id": "amsterdam",
  "name": "阿姆斯特丹",
  "name_en": "Amsterdam",
  "country_id": "netherlands",
  "country_name": "荷兰",
  "digital_nomad_score": 85,
  "cost_of_living_index": 85,
  "rent_index": 55,
  "safety_index": 72,
  "internet_speed_avg_mbps": 180,
  "coworking_spaces": 80,
  "coworking_score": 85,
  "climate": "温带海洋",
  "avg_temp_c": 11,
  "rainy_season": "全年分布",
  "english_level": "极高（几乎人人会说英语）",
  "chinese_community_size": "中等",
  "neighborhoods": [
    "Jordaan",
    "De Pijp",
    "Oud-West",
    "Amsterdam Noord"
  ],
  "food_scene": "国际美食，印尼菜， stroopwafel，咖啡",
  "nightlife": "Leidseplein，Rembrandtplein",
  "transportation": "电车/地铁/巴士/自行车，OV-chipkaart",
  "walkability": 85,
  "bike_friendly": 95,
  "description": "自行车之都，英语普及率极高，国际化程度高，但住房紧张。",
  "status": "published",
  "updated_at": "2026-01-15T00:00:00Z",
  "source": "Numbeo 2026"
}