{
  "id": "delhi",
  "name": "新德里",
  "name_en": "New Delhi",
  "country_id": "india",
  "country_name": "印度",
  "digital_nomad_score": 70,
  "cost_of_living_index": 32,
  "rent_index": 18,
  "safety_index": 50,
  "internet_speed_avg_mbps": 60,
  "coworking_spaces": 50,
  "coworking_score": 78,
  "climate": "半干旱",
  "avg_temp_c": 25,
  "rainy_season": "7-9月",
  "english_level": "高",
  "chinese_community_size": "中等",
  "neighborhoods": [
    "Connaught Place",
    "Hauz Khas",
    "GK",
    "Saket"
  ],
  "food_scene": "chaat、butter chicken、paratha",
  "nightlife": "Hauz Khas Village、Cyber Hub",
  "transportation": "地铁/ auto/出租车",
  "walkability": 50,
  "bike_friendly": 40,
  "description": "印度首都，历史与现代碰撞，美食天堂，但空气质量差。",
  "status": "published",
  "updated_at": "2026-07-06T00:00:00Z",
  "source": "Numbeo 2026, Nomad List, Local Research"
}
