{
  "id": "akureyri",
  "name": "阿克雷里",
  "name_en": "Akureyri",
  "country_id": "iceland",
  "country_name": "冰岛",
  "digital_nomad_score": 74,
  "cost_of_living_index": 85,
  "rent_index": 50,
  "safety_index": 95,
  "internet_speed_avg_mbps": 60,
  "coworking_spaces": 15,
  "coworking_score": 62,
  "climate": "亚极地海洋",
  "avg_temp_c": 4,
  "rainy_season": "全年",
  "english_level": "极高",
  "chinese_community_size": "极小",
  "neighborhoods": [
    "市中心",
    "Hafnarfjörður"
  ],
  "food_scene": "羊肉、skyr、海鲜",
  "nightlife": "酒吧、文化",
  "transportation": "巴士/步行",
  "walkability": 85,
  "bike_friendly": 60,
  "description": "北方之都，北极圈门户，极光观赏，冰岛第二城。",
  "status": "published",
  "updated_at": "2026-07-06T00:00:00Z",
  "source": "Numbeo 2026, Nomad List, Local Research"
}
