{
  "id": "toronto",
  "name": "多伦多",
  "name_en": "Toronto",
  "country_id": "canada",
  "country_name": "加拿大",
  "digital_nomad_score": 80,
  "cost_of_living_index": 80,
  "rent_index": 50,
  "safety_index": 70,
  "internet_speed_avg_mbps": 160,
  "coworking_spaces": 100,
  "coworking_score": 80,
  "climate": "温带大陆",
  "avg_temp_c": 9,
  "rainy_season": "全年分布",
  "english_level": "极高",
  "chinese_community_size": "大（万锦/列治文山）",
  "neighborhoods": [
    "Downtown",
    "Kensington Market",
    "Queen West",
    "Yorkville"
  ],
  "food_scene": "多元美食，中餐丰富，早午餐",
  "nightlife": "Queen West，Entertainment District",
  "transportation": "地铁/巴士/有轨电车，Presto卡",
  "walkability": 80,
  "bike_friendly": 70,
  "description": "加拿大最大城市，多元文化，华人社区庞大，但冬季寒冷。",
  "status": "published",
  "updated_at": "2026-01-15T00:00:00Z",
  "source": "Numbeo 2026"
}