{
  "id": "danang",
  "name": "岘港",
  "name_en": "Da Nang",
  "country_id": "vietnam",
  "country_name": "越南",
  "digital_nomad_score": 82,
  "cost_of_living_index": 28,
  "rent_index": 12,
  "safety_index": 80,
  "internet_speed_avg_mbps": 55,
  "coworking_spaces": 25,
  "coworking_score": 72,
  "climate": "热带季风",
  "avg_temp_c": 26,
  "rainy_season": "9-12月",
  "english_level": "中等",
  "chinese_community_size": "小",
  "neighborhoods": [
    "美溪海滩",
    "汉江",
    "山茶半岛"
  ],
  "food_scene": "越南粉、海鲜、banh xeo",
  "nightlife": "汉江畔、海滩酒吧",
  "transportation": "Grab/摩托车/巴士",
  "walkability": 70,
  "bike_friendly": 60,
  "description": "越南最宜居城市，海滩与山脉，干净现代，生活成本极低。",
  "status": "published",
  "updated_at": "2026-07-06T00:00:00Z",
  "source": "Numbeo 2026, Nomad List, Local Research"
}
