{
  "id": "austin",
  "name": "奥斯汀",
  "name_en": "Austin",
  "country_id": "usa",
  "country_name": "美国",
  "digital_nomad_score": 84,
  "cost_of_living_index": 72,
  "rent_index": 45,
  "safety_index": 70,
  "internet_speed_avg_mbps": 85,
  "coworking_spaces": 55,
  "coworking_score": 90,
  "climate": "亚热带",
  "avg_temp_c": 21,
  "rainy_season": "5-6月",
  "english_level": "极高",
  "chinese_community_size": "中等",
  "neighborhoods": [
    "South Congress",
    "East Austin",
    "Downtown",
    "Zilker"
  ],
  "food_scene": "BBQ、 tacos、精酿啤酒",
  "nightlife": "6th Street、Rainey Street、South Congress",
  "transportation": "巴士/自行车/出租车",
  "walkability": 65,
  "bike_friendly": 70,
  "description": "Keep Austin Weird，科技中心，音乐之都，德州自由氛围。",
  "status": "published",
  "updated_at": "2026-07-06T00:00:00Z",
  "source": "Numbeo 2026, Nomad List, Local Research"
}
