{
  "id": "reykjavik",
  "name": "雷克雅未克",
  "name_en": "Reykjavik",
  "country_id": "iceland",
  "country_name": "冰岛",
  "digital_nomad_score": 78,
  "cost_of_living_index": 90,
  "rent_index": 60,
  "safety_index": 95,
  "internet_speed_avg_mbps": 75,
  "coworking_spaces": 25,
  "coworking_score": 70,
  "climate": "亚极地海洋",
  "avg_temp_c": 5,
  "rainy_season": "全年",
  "english_level": "极高",
  "chinese_community_size": "小",
  "neighborhoods": [
    "101 Reykjavik",
    "Vesturbær"
  ],
  "food_scene": "羊肉汤、skyr、发酵鲨鱼肉",
  "nightlife": "Laugavegur、酒吧",
  "transportation": "巴士/步行",
  "walkability": 85,
  "bike_friendly": 60,
  "description": "世界最北首都，极光与温泉，自然奇观，但成本极高。",
  "status": "published",
  "updated_at": "2026-07-06T00:00:00Z",
  "source": "Numbeo 2026, Nomad List, Local Research"
}
