{
  "id": "colombo",
  "name": "科伦坡",
  "name_en": "Colombo",
  "country_id": "srilanka",
  "country_name": "斯里兰卡",
  "digital_nomad_score": 76,
  "cost_of_living_index": 28,
  "rent_index": 12,
  "safety_index": 70,
  "internet_speed_avg_mbps": 45,
  "coworking_spaces": 25,
  "coworking_score": 68,
  "climate": "热带",
  "avg_temp_c": 28,
  "rainy_season": "5月,10-11月",
  "english_level": "高",
  "chinese_community_size": "小",
  "neighborhoods": [
    "Colombo 1-7",
    "Cinnamon Gardens"
  ],
  "food_scene": "咖喱、hoppers、kottu",
  "nightlife": "Cinnamon Grand、Galle Face",
  "transportation": "tuk-tuk/巴士/火车",
  "walkability": 60,
  "bike_friendly": 40,
  "description": "印度洋上的宝石，破产危机后低成本，茶文化，海滩近。",
  "status": "published",
  "updated_at": "2026-07-06T00:00:00Z",
  "source": "Numbeo 2026, Nomad List, Local Research"
}
