{
  "id": "ulaanbaatar",
  "name": "乌兰巴托",
  "name_en": "Ulaanbaatar",
  "country_id": "mongolia",
  "country_name": "蒙古",
  "digital_nomad_score": 68,
  "cost_of_living_index": 30,
  "rent_index": 15,
  "safety_index": 70,
  "internet_speed_avg_mbps": 45,
  "coworking_spaces": 15,
  "coworking_score": 55,
  "climate": "极端大陆",
  "avg_temp_c": 0,
  "rainy_season": "7-8月",
  "english_level": "低",
  "chinese_community_size": "中等",
  "neighborhoods": [
    "Sukhbaatar",
    "Khan-Uul"
  ],
  "food_scene": "buuz、khorkhog、奶制品",
  "nightlife": "Sukhbaatar 广场、酒吧",
  "transportation": "巴士/出租车",
  "walkability": 70,
  "bike_friendly": 40,
  "description": "世界最冷首都，草原文化，免签30天，独特体验。",
  "status": "published",
  "updated_at": "2026-07-06T00:00:00Z",
  "source": "Numbeo 2026, Nomad List, Local Research"
}
