{
  "id": "stockholm",
  "name": "斯德哥尔摩",
  "name_en": "Stockholm",
  "country_id": "sweden",
  "country_name": "瑞典",
  "digital_nomad_score": 82,
  "cost_of_living_index": 80,
  "rent_index": 50,
  "safety_index": 90,
  "internet_speed_avg_mbps": 90,
  "coworking_spaces": 45,
  "coworking_score": 85,
  "climate": "温带大陆",
  "avg_temp_c": 7,
  "rainy_season": "全年均匀",
  "english_level": "极高",
  "chinese_community_size": "小",
  "neighborhoods": [
    "Södermalm",
    "Östermalm",
    "Gamla Stan",
    "Kungsholmen"
  ],
  "food_scene": "肉丸、腌三文鱼、fika 咖啡",
  "nightlife": "Södermalm、Stureplan",
  "transportation": "地铁/巴士/自行车",
  "walkability": 90,
  "bike_friendly": 90,
  "description": "北欧威尼斯，群岛之城，设计之都，但成本高。",
  "status": "published",
  "updated_at": "2026-07-06T00:00:00Z",
  "source": "Numbeo 2026, Nomad List, Local Research"
}
