{
  "id": "hanoi",
  "name": "河内",
  "name_en": "Hanoi",
  "country_id": "vietnam",
  "country_name": "越南",
  "digital_nomad_score": 78,
  "cost_of_living_index": 35,
  "rent_index": 12,
  "safety_index": 65,
  "internet_speed_avg_mbps": 110,
  "coworking_spaces": 30,
  "coworking_score": 60,
  "climate": "热带季风",
  "avg_temp_c": 24,
  "rainy_season": "5-9月",
  "english_level": "中等",
  "chinese_community_size": "中等",
  "neighborhoods": [
    "还剑湖",
    "巴亭",
    "西湖",
    "Cau Giay"
  ],
  "food_scene": "越南粉， Bun Cha，鸡蛋咖啡",
  "nightlife": "还剑湖，Ta Hien",
  "transportation": "Grab/摩托/的士",
  "walkability": 70,
  "bike_friendly": 50,
  "description": "越南首都，文化气息浓厚，生活节奏比胡志明慢，适合追求安静的数字游民。",
  "status": "published",
  "updated_at": "2026-01-15T00:00:00Z",
  "source": "Numbeo 2026"
}