{
  "id": "cusco",
  "name": "库斯科",
  "name_en": "Cusco",
  "country_id": "peru",
  "country_name": "秘鲁",
  "digital_nomad_score": 75,
  "cost_of_living_index": 28,
  "rent_index": 10,
  "safety_index": 65,
  "internet_speed_avg_mbps": 40,
  "coworking_spaces": 20,
  "coworking_score": 65,
  "climate": "高原",
  "avg_temp_c": 12,
  "rainy_season": "11-3月",
  "english_level": "中等",
  "chinese_community_size": "小",
  "neighborhoods": [
    "San Blas",
    "Centro"
  ],
  "food_scene": "安第斯菜、cuy、印加菜",
  "nightlife": "San Blas、酒吧",
  "transportation": "步行/出租车",
  "walkability": 90,
  "bike_friendly": 50,
  "description": "印加帝国首都，马丘比丘门户，海拔3400米需适应。",
  "status": "published",
  "updated_at": "2026-07-06T00:00:00Z",
  "source": "Numbeo 2026, Nomad List, Local Research"
}
