{
  "id": "debrecen",
  "name": "德布勒森",
  "name_en": "Debrecen",
  "country_id": "hungary",
  "country_name": "匈牙利",
  "digital_nomad_score": 76,
  "cost_of_living_index": 32,
  "rent_index": 12,
  "safety_index": 85,
  "internet_speed_avg_mbps": 70,
  "coworking_spaces": 15,
  "coworking_score": 65,
  "climate": "温带大陆",
  "avg_temp_c": 10,
  "rainy_season": "5-6月",
  "english_level": "中等",
  "chinese_community_size": "极小",
  "neighborhoods": [
    "市中心",
    "Nagyerdő"
  ],
  "food_scene": "匈牙利传统菜、香肠",
  "nightlife": "酒吧、俱乐部",
  "transportation": "电车/巴士",
  "walkability": 80,
  "bike_friendly": 75,
  "description": "匈牙利第二城，加尔文教中心，大平原门户，更安静。",
  "status": "published",
  "updated_at": "2026-07-06T00:00:00Z",
  "source": "Numbeo 2026, Nomad List, Local Research"
}
