{
  "id": "athens",
  "name": "雅典",
  "name_en": "Athens",
  "country_id": "greece",
  "country_name": "希腊",
  "digital_nomad_score": 85,
  "cost_of_living_index": 52,
  "rent_index": 25,
  "safety_index": 75,
  "internet_speed_avg_mbps": 65,
  "coworking_spaces": 40,
  "coworking_score": 80,
  "climate": "地中海",
  "avg_temp_c": 18,
  "rainy_season": "11-3月",
  "english_level": "高",
  "chinese_community_size": "中等",
  "neighborhoods": [
    "Plaka",
    "Koukaki",
    "Psirri",
    "Kolonaki"
  ],
  "food_scene": "souvlaki、希腊沙拉、moussaka",
  "nightlife": "Psirri、Gazi",
  "transportation": "地铁/巴士/电车",
  "walkability": 85,
  "bike_friendly": 60,
  "description": "西方文明摇篮，数字游民签证友好，岛屿跳岛便利。",
  "status": "published",
  "updated_at": "2026-07-06T00:00:00Z",
  "source": "Numbeo 2026, Nomad List, Local Research"
}
