{
  "id": "medellin",
  "name": "麦德林",
  "name_en": "Medellín",
  "country_id": "colombia",
  "country_name": "哥伦比亚",
  "digital_nomad_score": 85,
  "cost_of_living_index": 35,
  "rent_index": 15,
  "safety_index": 60,
  "internet_speed_avg_mbps": 55,
  "coworking_spaces": 40,
  "coworking_score": 82,
  "climate": "热带高原",
  "avg_temp_c": 22,
  "rainy_season": "4-5月,10-11月",
  "english_level": "中等",
  "chinese_community_size": "小",
  "neighborhoods": [
    "El Poblado",
    "Laureles",
    "Envigado"
  ],
  "food_scene": "bandeja paisa、热带水果",
  "nightlife": "El Poblado、屋顶酒吧",
  "transportation": "地铁/缆车/巴士",
  "walkability": 65,
  "bike_friendly": 55,
  "description": "永恒春天之城，数字游民热门地，创业氛围浓厚。",
  "status": "published",
  "updated_at": "2026-07-06T00:00:00Z",
  "source": "Numbeo 2026, Nomad List, Local Research"
}
