{
  "id": "munich",
  "name": "慕尼黑",
  "name_en": "Munich",
  "country_id": "germany",
  "country_name": "德国",
  "digital_nomad_score": 80,
  "cost_of_living_index": 82,
  "rent_index": 50,
  "safety_index": 80,
  "internet_speed_avg_mbps": 140,
  "coworking_spaces": 60,
  "coworking_score": 75,
  "climate": "温带大陆",
  "avg_temp_c": 9,
  "rainy_season": "全年分布",
  "english_level": "极高",
  "chinese_community_size": "中等",
  "neighborhoods": [
    "Altstadt",
    "Schwabing",
    "Glockenbach",
    "Maxvorstadt"
  ],
  "food_scene": "巴伐利亚菜，啤酒花园，国际美食",
  "nightlife": "Schwabing，Maxvorstadt",
  "transportation": "U-Bahn/S-Bahn/巴士，MVV",
  "walkability": 85,
  "bike_friendly": 80,
  "description": "德国最富裕城市，生活质量高，但租金和生活成本也高。",
  "status": "published",
  "updated_at": "2026-01-15T00:00:00Z",
  "source": "Numbeo 2026"
}