{
  "id": "thessaloniki",
  "name": "塞萨洛尼基",
  "name_en": "Thessaloniki",
  "country_id": "greece",
  "country_name": "希腊",
  "digital_nomad_score": 80,
  "cost_of_living_index": 42,
  "rent_index": 18,
  "safety_index": 80,
  "internet_speed_avg_mbps": 60,
  "coworking_spaces": 25,
  "coworking_score": 70,
  "climate": "地中海",
  "avg_temp_c": 16,
  "rainy_season": "11-3月",
  "english_level": "高",
  "chinese_community_size": "小",
  "neighborhoods": [
    "Ladadika",
    "Ano Poli"
  ],
  "food_scene": "bouyiourdi、海鲜、土耳其影响菜",
  "nightlife": "Ladadika、海滨酒吧",
  "transportation": "巴士/出租车",
  "walkability": 85,
  "bike_friendly": 70,
  "description": "希腊第二城，年轻活力，海滨生活，比雅典更实惠。",
  "status": "published",
  "updated_at": "2026-07-06T00:00:00Z",
  "source": "Numbeo 2026, Nomad List, Local Research"
}
