{
  "id": "kualalumpur",
  "name": "吉隆坡",
  "name_en": "Kuala Lumpur",
  "country_id": "malaysia",
  "country_name": "马来西亚",
  "digital_nomad_score": 82,
  "cost_of_living_index": 42,
  "rent_index": 18,
  "safety_index": 55,
  "internet_speed_avg_mbps": 150,
  "coworking_spaces": 80,
  "coworking_score": 80,
  "climate": "热带雨林",
  "avg_temp_c": 28,
  "rainy_season": "3-4月, 10-11月",
  "english_level": "高",
  "chinese_community_size": "大",
  "neighborhoods": [
    "KLCC",
    "武吉免登",
    "孟沙",
    "满家乐",
    "Desa ParkCity"
  ],
  "food_scene": "肉骨茶，海南鸡饭，叻沙，多元美食",
  "nightlife": "Changkat Bukit Bintang，TREC",
  "transportation": "LRT/MRT/单轨/Grab",
  "walkability": 60,
  "bike_friendly": 45,
  "description": "东南亚数字游民新宠，英语普及，华人友好，联合办公丰富。",
  "status": "published",
  "updated_at": "2026-01-15T00:00:00Z",
  "source": "Numbeo 2026"
}