{
  "id": "sao_paulo",
  "name": "圣保罗",
  "name_en": "São Paulo",
  "country_id": "brazil",
  "country_name": "巴西",
  "digital_nomad_score": 80,
  "cost_of_living_index": 45,
  "rent_index": 25,
  "safety_index": 50,
  "internet_speed_avg_mbps": 70,
  "coworking_spaces": 60,
  "coworking_score": 85,
  "climate": "亚热带",
  "avg_temp_c": 20,
  "rainy_season": "12-3月",
  "english_level": "中等",
  "chinese_community_size": "中等",
  "neighborhoods": [
    "Pinheiros",
    "Vila Madalena",
    "Jardins",
    "Itaim Bibi"
  ],
  "food_scene": "Pizza、寿司、巴西烤肉",
  "nightlife": "Vila Madalena、电子音乐",
  "transportation": "地铁/巴士/Uber",
  "walkability": 65,
  "bike_friendly": 55,
  "description": "南美经济中心，联合办公丰富，美食文化多元。",
  "status": "published",
  "updated_at": "2026-07-06T00:00:00Z",
  "source": "Numbeo 2026, Nomad List, Local Research"
}
