{
  "id": "warsaw",
  "name": "华沙",
  "name_en": "Warsaw",
  "country_id": "poland",
  "country_name": "波兰",
  "digital_nomad_score": 82,
  "cost_of_living_index": 48,
  "rent_index": 28,
  "safety_index": 85,
  "internet_speed_avg_mbps": 80,
  "coworking_spaces": 50,
  "coworking_score": 85,
  "climate": "温带大陆",
  "avg_temp_c": 8,
  "rainy_season": "6-7月",
  "english_level": "高",
  "chinese_community_size": "中等",
  "neighborhoods": [
    "Śródmieście",
    "Mokotów",
    "Praga",
    "Wola"
  ],
  "food_scene": "pierogi、żurek、波兰伏特加",
  "nightlife": "Nowy Świat、伏特加工厂",
  "transportation": "地铁/巴士/电车",
  "walkability": 80,
  "bike_friendly": 75,
  "description": "凤凰城，战后重建，现代商业与文化融合，东欧科技中心。",
  "status": "published",
  "updated_at": "2026-07-06T00:00:00Z",
  "source": "Numbeo 2026, Nomad List, Local Research"
}
