{
  "id": "singapore-city",
  "name": "新加坡",
  "name_en": "Singapore",
  "country_id": "singapore",
  "country_name": "新加坡",
  "digital_nomad_score": 88,
  "cost_of_living_index": 95,
  "rent_index": 85,
  "safety_index": 91,
  "internet_speed_avg_mbps": 280,
  "coworking_spaces": 150,
  "coworking_score": 95,
  "climate": "热带雨林",
  "avg_temp_c": 27,
  "rainy_season": "全年多雨",
  "english_level": "极高",
  "chinese_community_size": "大（华人占74%）",
  "neighborhoods": [
    "滨海湾",
    "乌节路",
    "牛车水",
    "武吉知马",
    "东海岸"
  ],
  "food_scene": "小贩中心文化，米其林街边美食，多元种族美食",
  "nightlife": "克拉码头，罗伯逊码头， rooftop bar",
  "transportation": "地铁/巴士/的士/Grab，交通卡EZ-Link",
  "walkability": 90,
  "bike_friendly": 75,
  "description": "全球最安全的数字游民城市之一，基础设施世界一流，但生活成本亚洲最高。",
  "status": "published",
  "updated_at": "2026-01-15T00:00:00Z",
  "source": "Numbeo 2026, Nomad List"
}